{
  "$schema": "../../packages/brand/schema.json",
  "slug": "example-church",
  "identity": {
    "name": "Example Community Church",
    "shortName": "Example Church",
    "tagline": "A Place to Belong",
    "description": "A fictional church used as ChurchKit's reference configuration."
  },
  "contact": {
    "phone": "(555) 010-0100",
    "email": "hello@example.org",
    "address": {
      "street": "100 Example Road",
      "city": "Springfield",
      "region": "IL",
      "postalCode": "62701",
      "country": "US"
    }
  },
  "timezone": "America/Chicago",
  "locale": "en-US",
  "serviceTimes": {
    "sunday": [
      "9:00 AM — Bible Study",
      "10:30 AM — Worship Service"
    ],
    "wednesday": [
      "6:30 PM — Midweek Gathering"
    ]
  },
  "colors": {
    "brand": "#2f4858",
    "brandMid": "#5b7b8a",
    "brandLight": "#8aa7b4",
    "brandPale": "#dbe5ea",
    "brandFaint": "#eef3f5",
    "accent": "#c77d3a",
    "accentPale": "#f7ece1",
    "ink": "#1a1a18",
    "inkSoft": "#4a4844",
    "inkFaint": "#8a8680",
    "surface": "#faf8f3",
    "white": "#ffffff",
    "border": "#e2ddd4",
    "borderSoft": "#ede9e0",
    "error": "#c0392b"
  },
  "fonts": {
    "heading": {
      "family": "Cormorant Garamond",
      "stack": "'Cormorant Garamond', Georgia, serif"
    },
    "body": {
      "family": "Roboto",
      "stack": "Roboto, system-ui, -apple-system, sans-serif"
    },
    "display": {
      "family": "Roboto",
      "stack": "Roboto, system-ui, sans-serif"
    },
    "webFontUrl": "https://fonts.googleapis.com/css2?family=Cormorant+Garamond:ital,wght@0,300;0,400;0,600;1,400&family=Roboto:wght@300;400;500;700&display=swap",
    "mobile": {
      "heading": "CormorantGaramond_600SemiBold",
      "headingItalic": "CormorantGaramond_600SemiBold_Italic",
      "body": "Roboto_400Regular",
      "bodyMedium": "Roboto_500Medium",
      "bodyBold": "Roboto_700Bold"
    }
  },
  "urls": {
    "web": "https://example.org",
    "api": "https://api.example.org",
    "media": "https://media.example.org",
    "churchCenter": "https://example.churchcenter.com",
    "giving": "https://example.churchcenter.com/giving",
    "privacy": "https://example.org/privacy",
    "terms": "https://example.org/terms"
  },
  "social": {
    "facebook": "",
    "instagram": "",
    "youtube": ""
  },
  "assets": {
    "logoDark": "assets/logo-dark.png",
    "logoWhite": "assets/logo-white.png",
    "logoIcon": "assets/logo-icon.png",
    "appIcon": "assets/icon.png",
    "appSplash": "assets/splash.png",
    "favicon": "assets/favicon.png"
  },
  "mobile": {
    "scheme": "examplechurch",
    "bundleIdentifier": "org.example.church",
    "androidPackage": "org.example.church",
    "version": "1.0.0",
    "iosBuildNumber": "1",
    "androidVersionCode": 1,
    "splashBackgroundColor": "#2f4858",
    "easProjectId": "",
    "updatesUrl": "",
    "onesignalAppId": "",
    "sentryDsn": "",
    "associatedDomain": ""
  }
}
